<?xml version="1.0"?>
<!-- <!DOCTYPE pacienti SYSTEM "pacienti.dtd"> -->
<pacienti xmlns:xsi="http://www.w3.org/2001/XMLSchema-instance" xsi:noNamespaceSchemaLocation="ProiectIordacheAlexandra.xsd">
    <pacient>
        <nume>Ana</nume>
        <prenume>Ionescu</prenume>
        <data_nastere>20-03-1997</data_nastere>
        <sex>Feminin</sex>
        <adresa>str. Florilor, nr. 23, Bucuresti</adresa>
        <istoric_medical>
            <alergii>Niciuna</alergii>
            <boli_cronice>Niciuna</boli_cronice>
            <antecedente_chirurgicale>Niciuna</antecedente_chirurgicale>
        </istoric_medical>
        <diagnostic>Tulburare de somn</diagnostic>
        <tratament>Somnifere</tratament>
        <eeg>
            <data_inregistrare>12-02-2024</data_inregistrare>
            <ora_inregistrare>10:00</ora_inregistrare>
            <imagine_eeg>imagini_eeg/ana_ionescu_12022024.png</imagine_eeg>
            <interpretare>Activitate cerebrală normală</interpretare>
            <semnale_eeg_de_interes>
                <semnal>
                    <denumire_electrod>LG</denumire_electrod>
                    <amplitudine>10 µV</amplitudine>
                    <frecventa>10 Hz</frecventa>
                </semnal>
                <semnal>
                    <denumire_electrod> RG </denumire_electrod>
                    <amplitudine>12 µV</amplitudine>
                    <frecventa>12 Hz</frecventa>
                </semnal>
                <semnal>
                    <denumire_electrod>LA</denumire_electrod>
                    <amplitudine>11 µV</amplitudine>
                    <frecventa>10 Hz</frecventa>
                </semnal>
                <semnal>
                    <denumire_electrod>RA</denumire_electrod>
                    <amplitudine>9 µV</amplitudine>
                    <frecventa>13 Hz</frecventa>
                </semnal>
                <semnal>
                    <denumire_electrod>LQ</denumire_electrod>
                    <amplitudine>15 µV</amplitudine>
                    <frecventa>15 Hz</frecventa>
                </semnal>
                <semnal>
                    <denumire_electrod>RQ</denumire_electrod>
                    <amplitudine>10 µV</amplitudine>
                    <frecventa>11 Hz</frecventa>
                </semnal>
            </semnale_eeg_de_interes>
        </eeg>
    </pacient>
    <pacient>
        <nume>Alexandru</nume>
        <prenume>Popescu</prenume>
        <data_nastere>15-09-1985</data_nastere>
        <sex>Masculin</sex>
        <adresa>str. Mihai Viteazu, nr. 10, Cluj-Napoca</adresa>
        <istoric_medical>
            <alergii>Polen</alergii>
            <boli_cronice>Niciuna</boli_cronice>
            <antecedente_chirurgicale>Niciuna</antecedente_chirurgicale>
        </istoric_medical>
        <diagnostic>Epilepsie</diagnostic>
        <tratament>Antiepileptice</tratament>
        <eeg>
            <data_inregistrare>15-03-2024</data_inregistrare>
            <ora_inregistrare>08:30</ora_inregistrare>
            <imagine_eeg>imagini_eeg/ioan_popescu_15032024.png</imagine_eeg>
            <interpretare>Activitate epileptică detectată</interpretare>
            <semnale_eeg_de_interes>
                <semnal>
                    <denumire_electrod>LO</denumire_electrod>
                    <amplitudine>14 µV</amplitudine>
                    <frecventa>8 Hz</frecventa>
                </semnal>
                 <semnal>
                    <denumire_electrod>RO</denumire_electrod>
                    <amplitudine>13 µV</amplitudine>
                    <frecventa>8 Hz</frecventa>
                </semnal>
                 <semnal>
                    <denumire_electrod>LA</denumire_electrod>
                    <amplitudine>14 µV</amplitudine>
                    <frecventa>8 Hz</frecventa>
                </semnal>
                 <semnal>
                    <denumire_electrod>RA</denumire_electrod>
                    <amplitudine>14 µV</amplitudine>
                    <frecventa>14 Hz</frecventa>
                </semnal>
                 <semnal>
                    <denumire_electrod>LB</denumire_electrod>
                    <amplitudine>15 µV</amplitudine>
                    <frecventa>10 Hz</frecventa>
                </semnal>
                 <semnal>
                    <denumire_electrod>RB</denumire_electrod>
                    <amplitudine>9 µV</amplitudine>
                    <frecventa>11 Hz</frecventa>
                </semnal>
                 <semnal>
                    <denumire_electrod>LE</denumire_electrod>
                    <amplitudine>9 µV</amplitudine>
                    <frecventa>12 Hz</frecventa>
                </semnal>
                 <semnal>
                    <denumire_electrod>RE</denumire_electrod>
                    <amplitudine>10 µV</amplitudine>
                    <frecventa>12 Hz</frecventa>
                </semnal>
            </semnale_eeg_de_interes>
        </eeg>
    </pacient>
    <pacient>
        <nume>Maria</nume>
        <prenume>Georgescu</prenume>
        <data_nastere>05-07-1976</data_nastere>
        <sex>Feminin</sex>
        <adresa>str. Rozelor, nr. 5, Timisoara</adresa>
        <istoric_medical>
            <alergii>Niciuna</alergii>
            <boli_cronice>Hipertensiune arterială</boli_cronice>
            <antecedente_chirurgicale>Chirurgie cardiacă în 2010</antecedente_chirurgicale>
        </istoric_medical>
        <diagnostic>Migrenă cronică</diagnostic>
        <tratament>Analgezice</tratament>
        <eeg>
            <data_inregistrare>28-01-2024</data_inregistrare>
            <ora_inregistrare>11:45</ora_inregistrare>
            <imagine_eeg>imagini_eeg/maria_georgescu_28052024.png</imagine_eeg>
            <interpretare>Activitate cerebrală normală, cu semne de hiperexcitabilitate în anumite regiuni</interpretare>
            <semnale_eeg_de_interes>
                <semnal>
                    <denumire_electrod>LH</denumire_electrod>
                    <amplitudine>9 µV</amplitudine>
                    <frecventa>12 Hz</frecventa>
                </semnal>
                <semnal>
                    <denumire_electrod>RH</denumire_electrod>
                    <amplitudine>10 µV</amplitudine>
                    <frecventa>11 Hz</frecventa>
                </semnal>
                <semnal>
                    <denumire_electrod>LG</denumire_electrod>
                    <amplitudine>10 µV</amplitudine>
                    <frecventa>13 Hz</frecventa>
                </semnal>
                <semnal>
                    <denumire_electrod>RG</denumire_electrod>
                    <amplitudine>9 µV</amplitudine>
                    <frecventa>15 Hz</frecventa>
                </semnal>
            </semnale_eeg_de_interes>
        </eeg>
    </pacient>
</pacienti>
